url,type,text
https://www.rad.cvm.gov.br/ENET/frmDownloadDocumento.aspx?Tela=ext&numSequencia=879849&numVersao=1&numProtocolo=1355123&descTipo=IPE&CodigoInstituicao=1,FATO_RELEVANTE,"Vale estabelece joint-venture em Aliança Energia.
Rio de Janeiro, 31 de março de 2025 - A Vale S.A. (“Vale” ou a “Companhia”) informa que celebrou um acordo com a Global Infrastructure Partners (“GIP”) para estabelecer uma joint venture na Aliança Geração de Energia S.A. (“Aliança Energia”), uma empresa privada que atua no mercado brasileiro de energia. Uma vez concluída a transação, a Vale receberá aproximadamente US$ 1 bilhão1 em dinheiro e deterá uma participação de 30% na joint venture, enquanto a GIP terá os 70% restantes.
A transação garante volume estratégico de geração de energia para manter a matriz elétrica da Vale, que é 100% baseada em fontes renováveis no Brasil. Com a transação, a Vale garante custos de energia competitivos, com preços definidos em dólares americanos sem ajuste de inflação.  
Na conclusão da transação, a Aliança Energia passará a consolidar os ativos de energia do parque solar Sol do Cerrado e a integralidade do Consórcio Candonga (Usina Hidrelétrica Risoleta Neves), ambos em Minas Gerais, além de outras seis usinas hidrelétricas no mesmo estado e três parques eólicos nos estados do Rio Grande do Norte e do Ceará. Juntos, esses ativos alcançam 2.189 MW em capacidade instalada e 1.003 MW médios de garantia física. 
“Estamos entusiasmados em formar esta parceria estratégica com a GIP, permitindo-nos acelerar o plano de descarbonização da Vale de uma forma mais eficiente em termos de capital. Esta plataforma recém-formada nos fornecerá soluções renováveis competitivas à medida que entregamos um futuro com uma pegada de carbono menor”, disse Gustavo Pimenta, CEO da Vale.  
A Vale esclarece que a transação está sujeita às condições precedentes usuais, incluindo a anuência ou a aprovação de órgãos regulatórios competentes. A Vale reitera que manterá o mercado informado tempestivamente sobre qualquer fato relevante no contexto da referida transação. 
Sobre o GIP 
O GIP é um dos maiores gestores globais de fundos de infraestrutura, com um portfólio de ativos de cerca de US$ 170 bilhões, incluindo diversas joint-ventures com destacados grupos do setor de energia mundial. No Brasil, por meio da propriedade do grupo latino-americano Atlas Renewable Energy, o GIP controla uma plataforma de geração com aproximadamente 983 MW de capacidade instalada na Bahia, Ceará e Minas Gerais. O GIP segue uma rigorosa abordagem ESG e, desde 2024, é controlada pela Blackrock, um dos maiores investidores institucionais do mundo. 
Marcelo Feriozzi Bacci 
Vice-Presidente Executivo de Finanças e Relações com Investidores"
https://www.rad.cvm.gov.br/ENET/frmDownloadDocumento.aspx?Tela=ext&numSequencia=863114&numVersao=1&numProtocolo=1338388&descTipo=IPE&CodigoInstituicao=1,FATO_RELEVANTE,"Vale informa sobre atualização de projeções.
Rio de Janeiro, 24 de fevereiro de 2025 – A Vale S.A. (“Vale” ou “Companhia) informa que atualizou as estimativas referentes a sensibilidade de fluxo de caixa da Companhia, a ser apresentada na Conferência BMO Global Metals, Mining & Critical Minerals, em Miami, na data de hoje. 
Fluxo de Caixa Livre: 
Sensibilidade do Fluxo de Caixa Livre para o acionista (“FCFE”) da Vale em 2025, em termos reais, de US$ 3,85,0 bilhões, representando um FCFE yield de 9-12%, com base nas seguintes premissas: (a) Consenso de EBITDA Proforma de 2025 de analistas sell side de US$ 15,5 bilhões; (b) Capex de ~US$ 5,9 bilhões; (c) US$ 1,9-2,4 bilhões em juros e impostos; (d) ~US$ 0,9 bilhões em despesas incorridas relacionadas a Brumadinho e descaracterização de barragens; (e) US$ 0,8-1,0 bilhão de Associadas e JVs; e (f) US$ 1,0-1,5 bilhões para Outros desembolsos, como pagamentos de juros sobre debêntures participativas, desembolsos relacionados a contratos de concessão ferroviária e transações de streaming. 
Sensibilidade da geração de FCFE acumulado da Vale nos próximos 3 anos (2025-27), em termos reais, de US$ 13-15,0 bilhões, representando FCFE yield acumulado de 30-35%, com base: (a) no ganho anualizado esperado de EBITDA em 2027 de ~US$ 5 bilhões, proveniente da redução nos custos C1 (aproximadamente US$ 0,6 bilhões, em linha com guidance de anteriormente fornecido pela Vale para C1/t), melhorias no custo all-in (~US$ 1,3 bilhão), um adicional de 30 Mt de volumes de minério de ferro (~US$ 1,1 bilhão) e aumento nas margens e volumes da Vale Base Metals (VBM) de US$ 1,5-2,0 bilhões, em linha com os guidances de custo C1/t em minério de ferro, custos all-in/t e produção anteriormente fornecidos pela Vale; (b) premissa de preço de minério de ferro, conforme consenso de analistas de mercado, de U$99/t (2025), US$91/t (2026) e US$ 89/t (2027). 
Os FCFE yields foram calculados com base no market cap de fechamento do dia 21 de fevereiro de 2025.
Todas as demais estimativas indicadas pela Vale no fato relevante de 19 de fevereiro de 20251, e no item 3 de seu Formulário de Referência seguem inalteradas. O referido item do Formulário de Referência da Companhia será reapresentado com a atualização acima em momento oportuno, conforme prazo previsto na Resolução CVM nº 80/2022. 
A Vale esclarece que as informações divulgadas neste documento representam apenas uma estimativa, dados hipotéticos que não constituem, de forma alguma, uma promessa de desempenho por parte da Vale e/ou de sua administração. As projeções apresentadas envolvem fatores de mercado alheios ao controle da Vale e, dessa forma, podem sofrer novas alterações. 
Marcelo Feriozzi Bacci 
Vice-Presidente Executivo de Finanças e Relações com Investidores"
https://www.rad.cvm.gov.br/ENET/frmDownloadDocumento.aspx?Tela=ext&numSequencia=859705&numVersao=1&numProtocolo=1334979&descTipo=IPE&CodigoInstituicao=1,FATO_RELEVANTE,"Vale esclarece sobre alienação de participação na Aliança Energia.
Rio de Janeiro, 14 de fevereiro de 2025 – Em atenção ao artigo de imprensa publicado1 sobre a alienação de participação na Aliança Geração de Energia S.A. (“Aliança Energia”), a Vale S.A. (“Vale” ou “Companhia) esclarece que está avaliando potencial alienação de 70% de participação na Aliança Energia, incluindo os ativos de energia Sol do Cerrado e Consórcio Candonga, presentes no portfólio da Companhia, para a Global Infrastructure Partners (""GIP""). A Vale informa que não há qualquer instrumento vinculante firmado quanto à alienação e que qualquer decisão nesse sentido será tomada em conformidade com as políticas e regras de governança da Companhia. A Vale reitera que seguirá mantendo o mercado informado tempestivamente sobre qualquer fato relevante a respeito de seus negócios. 
Marcelo Feriozzi Bacci 
Vice-Presidente Executivo de Finanças e Relações com Investidores "
https://www.rad.cvm.gov.br/ENET/frmDownloadDocumento.aspx?Tela=ext&numSequencia=966124&numVersao=1&numProtocolo=1441412&descTipo=IPE&CodigoInstituicao=1,FATO_RELEVANTE,"Petrobras informa sobre remuneração aos acionistas.
Rio de Janeiro, 06 de novembro de 2025 – A Petróleo Brasileiro S.A. – Petrobras, nos termos da Resolução CVM nº 44/21, informa que seu Conselho de Administração (CA), em reunião realizada hoje, aprovou o pagamento de dividendos intercalares no valor de R$ 12,16 bilhões, equivalente a R$ 0,94320755 por ação ordinária e preferencial em circulação, como antecipação da remuneração aos acionistas relativa ao exercício de 2025, declarada com base no balanço de 30 de setembro de 2025. 
O pagamento proposto está alinhado à Política de Remuneração aos Acionistas (Política) vigente, que prevê que, em caso de endividamento bruto igual ou inferior ao nível máximo de endividamento definido no plano de negócios em vigor (atualmente US$ 75 bilhões), e observadas as demais condições da Política, a Petrobras deverá distribuir aos seus acionistas 45% do fluxo de caixa livre. Esta distribuição não compromete a sustentabilidade financeira da companhia. 
Os proventos serão pagos em duas parcelas nos meses de fevereiro e março de 2026, da seguinte forma: 
Valor a ser pago: R$ 0,94320755 por ação ordinária e preferencial em circulação, sendo que: 
(i) a primeira parcela, no valor de R$ 0,47160378 por ação ordinária e preferencial em circulação, será paga em 20 de fevereiro de 2026. 
(ii) a segunda parcela, no valor de R$ 0,47160377 por ação ordinária e preferencial em circulação, será paga em 20 de março de 2026.  
Data de corte: dia 22 de dezembro de 2025 para os detentores de ações de emissão da Petrobras negociadas na B3 e record date em 26 de dezembro de 2025 para os detentores de ADRs negociados na New York Stock Exchange (NYSE). As ações da Petrobras serão negociadas ex-direitos na B3 a partir de 23 de dezembro de 2025. 
Data de pagamento: para os detentores de ações de emissão da Petrobras negociadas na B3, o pagamento da primeira parcela será realizado no dia 20 de fevereiro de 2026 e o da segunda parcela no dia 20 de março de 2026. Os detentores de ADRs receberão os pagamentos a partir de 27 de fevereiro de 2026 e a partir de 27 de março de 2026, respectivamente. 
Forma de distribuição:  A definição da forma de distribuição (se sob a forma de dividendos e/ou juros sobre capital próprio) ocorrerá até 11 de dezembro de 2025 e será tempestivamente comunicada ao mercado.  
Importante ressaltar que os valores de cada parcela serão atualizados pela variação da taxa Selic de 31 de dezembro de 2025 até a data de cada pagamento; e em caso de pagamento sob a forma de juros sobre capital próprio (JCP), incidirá imposto de renda, conforme legislação vigente. Por fim, esses proventos serão devidamente abatidos da remuneração aos acionistas a ser aprovada na Assembleia Geral Ordinária de 2026 relativa ao exercício de 2025.  
A Política de Remuneração aos Acionistas pode ser acessada pelo site da companhia (http://www.petrobras.com.br/ri)."
https://www.rad.cvm.gov.br/ENET/frmDownloadDocumento.aspx?Tela=ext&numSequencia=940826&numVersao=1&numProtocolo=1416114&descTipo=IPE&CodigoInstituicao=1,FATO_RELEVANTE,"Petrobras aprova novo Presidente do Conselho de Administração.
Rio de Janeiro, 21 de agosto de 2025 – A Petróleo Brasileiro S.A.- Petrobras, em continuidade ao Fato Relevante divulgado em 20/08/2025, informa que seu Conselho de Administração (CA), em reunião realizada hoje, aprovou o Conselheiro Bruno Moretti como novo Presidente do CA, nos termos do §2º do art. 18 do Estatuto Social, com mandato até a próxima Assembleia Geral. 
Bruno Moretti é formado em economia pela Universidade Federal Fluminense (UFF), possui mestrado em Economia da Indústria pela Universidade Federal do Rio de Janeiro (UFRJ), Doutorado em Sociologia pela Universidade de Brasília (UnB) e estágio pós-doutoral em Sociologia pela UnB. Atualmente, é doutorando em Desenvolvimento Econômico pela Unicamp. Iniciou sua carreira como Analista de Planejamento e Orçamento do Ministério do Planejamento, em 2004. Entre 2009 e 2012, foi Diretor da Secretaria de Planejamento e Investimentos Estratégicos. De 2013 a 2014 atuou como Assessor da Secretaria Executiva do Ministério do Planejamento e foi membro suplente do Conselho Deliberativo da Funpresp. Entre 2013 e 2015, atuou no Conselho de Administração e Conselho Fiscal do EBSERH. Foi Diretor e Secretário-Executivo Substituto da Secretaria Executiva do Ministério da Saúde, entre 2014 e 2015. De 2015 a 2016 atuou como Secretário-Executivo Adjunto da Casa-Civil da Presidência da República. Foi Assessor Técnico no Senado Federal, de Economia, infraestrutura, política fiscal e orçamento público entre 2017 e 2022. Atualmente é Secretário Especial de Análise Governamental da Presidência da República, Conselheiro de Administração da Petrobras e Membro do Comitê de Investimentos da Petrobras."
https://www.rad.cvm.gov.br/ENET/frmDownloadDocumento.aspx?Tela=ext&numSequencia=940248&numVersao=1&numProtocolo=1415536&descTipo=IPE&CodigoInstituicao=1,FATO_RELEVANTE,"Petrobras informa sobre Presidente do Conselho de Administração.
Rio de Janeiro, 20 de agosto de 2025 – A Petróleo Brasileiro S.A.- Petrobras, em continuidade ao Comunicado divulgado em 16/12/2024, informa que recebeu hoje a renúncia, com efeitos imediatos, do Presidente do Conselho de Administração da companhia, Pietro Adamo Sampaio Mendes, aos cargos de Presidente e membro do Conselho de Administração da Petrobras em razão de novos desafios profissionais. 
O Sr. Pietro Adamo Sampaio Mendes, ao renunciar, deixou seu agradecimento aos colegas de Conselho, aos membros da Diretoria Executiva liderados pela presidente Magda Chambriard e às equipes da Petrobras pela colaboração durante seu período à frente do Conselho de Administração e desejou sucesso a todos na caminhada que prossegue. 
O §2º do Art.18 do Estatuto Social da companhia prevê que o próprio Conselho de Administração pode eleger o substituto no caso de vacância do cargo de Presidente do Conselho, eleição válida até a próxima Assembleia Geral que vier a ocorrer. 
A Petrobras manterá o mercado informado sobre o tema.  "
https://www.rad.cvm.gov.br/ENET/frmDownloadDocumento.aspx?Tela=ext&numSequencia=899554&numVersao=1&numProtocolo=1374842&descTipo=IPE&CodigoInstituicao=1,COMUNICADO,"Petrobras informa sobre nova descoberta de petróleo na Bacia de Santos.
Rio de Janeiro, 9 de maio de 2025 - A Petróleo Brasileiro S.A. – Petrobras informa que identificou a presença de petróleo de excelente qualidade e sem contaminantes no pré-sal da Bacia de Santos, em poço exploratório no bloco Aram.   
O poço 3-BRSA-1396D-SPS está localizado a 248 km da cidade de Santos-SP, em profundidade d’água de 1.952 metros. A perfuração desse poço já foi concluída, tendo o intervalo portador de petróleo sido constatado através de perfis elétricos, indícios de gás e amostragem de fluido. 
O consórcio dará início às análises laboratoriais para caracterizar as condições dos reservatórios e fluidos encontrados, que permitirão avaliar o potencial da área. Além disso, serão perfurados mais dois poços e realizado um teste de formação como parte do Plano de Avaliação de Descoberta (PAD). 
O PAD tem prazo final em 2027 e atividades adicionais de aquisição de dados poderão ser realizadas, conforme planejamento e obrigações contratuais estabelecidas junto à Agência Nacional do Petróleo, Gás Natural e Biocombustíveis (ANP). 
O bloco Aram foi adquirido em março de 2020, na 6ª rodada de licitação da ANP, sob o regime de Partilha de Produção, tendo a Pré-Sal Petróleo S.A. (PPSA) como gestora. A Petrobras é a operadora do bloco e detém 80% de participação, em parceria com a empresa CNPC (20%)."
https://www.rad.cvm.gov.br/ENET/frmDownloadDocumento.aspx?Tela=ext&numSequencia=868751&numVersao=1&numProtocolo=1344025&descTipo=IPE&CodigoInstituicao=1,FATO_RELEVANTE,"Petrobras assina acordo para encerrar litígio com a EIG Energy nos Estados Unidos.
Rio de Janeiro, 07 de março de 2025 – A Petróleo Brasileiro S.A. – Petrobras informa, em continuidade aos comunicados de 31/03/2017 e 09/08/2022, que seu Conselho de Administração aprovou celebração de acordo para encerramento de pendência judicial com a EIG Energy Fund XIV, LP. e outros (EIG). O valor desta contingência está provisionado nas Demonstrações Financeiras da Petrobras e vem sendo atualizado desde 2022. 
O acordo não constitui reconhecimento de culpa ou de prática de atos irregulares pela Petrobras e atende aos melhores interesses da Companhia e de seus acionistas, tendo em vista as peculiaridades da legislação norte-americana, aplicável ao julgamento da causa, bem como o estágio processual e as características de litígios nas Cortes Federais dos Estados Unidos. 
A ação judicial foi proposta em face da Companhia perante a Corte Federal do Distrito de Columbia, nos Estados Unidos, e é relacionada ao investimento da EIG no FIP Sondas, ex-acionista da Sete Brasil Participações S.A. (Sete Brasil). 
Nos termos do acordo, a Petrobras pagará US$ 283 milhões, ao passo que a EIG pedirá o encerramento da ação e renunciará a qualquer direito relacionado à disputa. "
https://www.rad.cvm.gov.br/ENET/frmDownloadDocumento.aspx?Tela=ext&numSequencia=959294&numVersao=2&numProtocolo=1434582&descTipo=IPE&CodigoInstituicao=1,FATO_RELEVANTE,"A Companhia de Saneamento do Paraná – Sanepar (“Companhia”), em cumprimento à Resolução CVM nº 44/2021, informa a seus acionistas, investidores e ao mercado em geral que a Agepar, em Reunião de seu Conselho Diretor realizada nesta data, informou sobre solicitação de manifestação feita pelo Tribunal de Contas do Estado do Paraná – TCE-PR à Agência diante de questionamento formulado pela Associação Paranaense de Defesa dos Direitos do Consumidor – APDC ao TCE-PR, e ratificou a decisão do Conselheiro-Presidente da Agepar de adoção de medida cautelar para suspensão dos efeitos da previsão de compartilhamento de ganhos com recuperação de créditos fiscais, prevista no Manual de Revisão Tarifária dos Serviços de Saneamento Básico de Água e Esgoto e suas aplicações (Nota Técnica nº 7/2024 – AGEPAR – DRE/CSB), até manifestação final de mérito por parte do Conselho Diretor da Agepar. 
O Conselho Diretor da Agepar informou, ainda, que o objeto dos autos consiste em tema extenso e complexo que deve ser submetido à análise das áreas técnicas da Agência e que não houve tempo hábil para que tal providência fosse levada a efeito previamente ao decurso de prazo fornecido pelo TCE-PR. Assim, para evitar que fossem adotadas providências irreversíveis em relação à destinação dos valores abordados, determinou a adoção de medida cautelar supracitada. 
A Companhia informa que envidará todos os esforços para resguardar seus interesses e manterá o mercado informado sobre o tema."
https://www.rad.cvm.gov.br/ENET/frmDownloadDocumento.aspx?Tela=ext&numSequencia=974047&numVersao=1&numProtocolo=1449335&descTipo=IPE&CodigoInstituicao=1,COMUNICADO,"A Companhia de Saneamento do Paraná – Sanepar (“Companhia”), em cumprimento ao disposto nas resoluções da CVM, comunica a seus acionistas, investidores e ao mercado em geral que, na Reunião da Diretoria Executiva realizada nesta data, foi aprovado o Plano de Equacionamento do Déficit Técnico do Plano de Previdência - FusanPrev com data-base em 31 de dezembro de 2024. 
De acordo com a Lei Complementar Nº 109/2001, o resultado deficitário nos planos ou nas entidades fechadas deve ser equacionado por patrocinadores, participantes e assistidos, na proporção existente entre as suas contribuições. 
Em respeito à Resolução CNPC nº 30/2018, o início do Plano de Equacionamento deverá ser até o início de vigência do plano de custeio estabelecido pela avaliação atuarial de encerramento de exercício em que se deu a aprovação do referido plano de equacionamento, qual seja, abril de 2026. 
O montante total a ser equacionado é da ordem de R$ 83,7 milhões, sendo de responsabilidade da Companhia o valor de R$ 41,2 milhões, em valores de 31/12/2024, a ser pago em parcelas mensais e sucessivas, iniciando-se em abril de 2026 e finalizando em fevereiro de 2038. O valor da parcela mensal da Patrocinadora é de aproximadamente R$ 288 mil, acrescido de juros atuariais e atualização monetária pelo INPC/IBGE. 
Destaca-se que há provisão contábil no Balanço Patrimonial da Companhia referente ao Plano de Previdência - FusanPrev que contempla o déficit apurado no encerramento do ano de 2024."
https://www.rad.cvm.gov.br/ENET/frmDownloadDocumento.aspx?Tela=ext&numSequencia=889829&numVersao=1&numProtocolo=1365103&descTipo=IPE&CodigoInstituicao=1,FATO_RELEVANTE,"A Companhia de Saneamento do Paraná – Sanepar (“Companhia”) em cumprimento ao disposto na Resolução CVM nº 44/2021 e em continuidade ao Fato Relevante de 20 de março de 2025, informa a seus acionistas, investidores e ao mercado em geral, que o Conselho de Administração em sua 10ª Reunião Extraordinária, realizada nesta data, considerando a publicação, em 10 de abril de 2025, da Lei Orçamentária Anual da União de 2025 (LOA 2025), Lei 15.121/2025, aprovou o registro contábil e recolhimento dos  tributos por ocasião do registro da receita auferida, relativo ao Processo da Ação Judicial movida contra a União sobre Imunidade Tributária Recíproca de IRPJ-Imposto de Renda Pessoa Jurídica, precatório nº 1189180920244019198. 
O registro contábil supra mencionado envolve lançamentos no ativo, passivo e resultado, entre outros: (i) ao reconhecimento da receita; (ii) constituição de passivo regulatório referente ao compartilhamento em favor da modicidade tarifária atualmente definido pela Agência Reguladora de Serviços Públicos Delegados do Paraná (Agepar); (iii) provisão de honorários advocatícios e; (iv) recolhimento de Tributos; destacando que tais registros se encontram em fase de elaboração pela Administração visando sua publicação por ocasião da divulgação das Demonstrações Contábeis Intermediárias do 1º Trimestre de 2025. 
Em relação aos demais andamentos relativos ao processo, reiteramos que: 
I. Ainda não há cronograma estabelecido para o recebimento pela Companhia dos benefícios econômicos (entrada de recursos) originários do precatório; 
II. A Companhia enviou ofício à Agepar, em 20 de março de 2025, solicitando tratamento regulatório específico em relação à ação de imunidade tributária (oriunda da ação originária nº 0008066- 96.1994.4.01.3400 e do cumprimento de sentença nº 1074228-74.2022.4.01.3400, ambas da 21ª Vara Federal Cível da Seção Judiciária do Distrito Federal), diante do caráter excepcional do tema. 
A Companhia manterá o mercado informado sobre o andamento deste processo."
https://www.rad.cvm.gov.br/ENET/frmDownloadDocumento.aspx?Tela=ext&numSequencia=864116&numVersao=1&numProtocolo=1339390&descTipo=IPE&CodigoInstituicao=1,FATO_RELEVANTE,"A Companhia de Saneamento do Paraná – Sanepar (“Companhia”), em cumprimento ao disposto na Resolução CVM nº 44/2021, e em continuidade aos Comunicados ao Mercado de 18 de dezembro de 2024 e 27 de janeiro de 2025, comunica a seus acionistas, investidores e ao mercado em geral que o Conselho Diretor da Agência Reguladora de Serviços Públicos Delegados do Paraná (Agepar), em reunião realizada nesta data, tornou pública a análise das contribuições recebidas na Consulta Pública nº 11/2024 e informou a respeito da Audiência Pública, a ser realizada em 13 de março de 2025, às 10h00, sobre a Nota Técnica DRE/CSB nº 003/2025, que se refere à aplicação preliminar das metodologias de cálculo tarifário para a 3ª Revisão Tarifária Periódica dos serviços de água e esgoto da Sanepar. 
O Conselho Diretor da Agepar divulgou a tarifa média preliminar para os serviços de água e esgoto, que resultou em R$ 6,89/m³ (seis reais e oitenta e nove centavos por metro cúbico), e o índice de correção de 4,6969%, calculado preliminarmente, a ser aplicado de forma linear em toda a estrutura tarifária da Sanepar atualmente vigente. 
A Companhia manterá o mercado informado sobre o andamento do tema. "
https://www.rad.cvm.gov.br/ENET/frmDownloadDocumento.aspx?Tela=ext&numSequencia=941615&numVersao=1&numProtocolo=1416903&descTipo=IPE&CodigoInstituicao=1,COMUNICADO,"8ª EMISSÃO DE DEBÊNTURES PARA RESGATE ANTECIPADO DAS DEBÊNTURES DA 6ª EMISSÃO.
ITAÚSA S.A. (“Itaúsa”) (B3: ITSA3, ITSA4) comunica que, em continuidade à estratégia de gestão de passivos e desalavancagem iniciada ao final de 2022, provou a 8ª Emissão de Debêntures, não conversíveis em ações, no montante de R$ 1,0 bilhão (“8ª Emissão”). Os recursos da 8ª Emissão, somados a R$ 250 milhões de recursos próprios, serão utilizados para o resgate antecipado da totalidade das debêntures da 6ª Emissão da Itaúsa (“6ª Emissão”), no valor de R$ 1,25 bilhão (“Refinanciamento”). 
A 6ª Emissão, que será resgatada, possui amortizações em 2029, 2030 e 2031, e custo de CDI+1,37% ao ano. A 8ª Emissão tem prazo de vencimento final de 10 anos, com amortizações em 2032, 2033, 2034 e 2035, e custo de CDI+0,6% ao ano, o que permite uma relevante redução do custo da dívida associada ao alongamento do prazo médio de vencimento.  
O Refinanciamento reforça a nossa disciplina financeira e perfil conservador e, em conjunto com o resgate antecipado das debêntures da 4ª Emissão anunciado em 30 de junho de 2025, permitirá à Itaúsa: (i) reduzir o custo médio da dívida para CDI+1,1% ao ano; (ii) reduzir as amortizações entre 2029 e 2031; (iii) alongar o perfil da dívida e prazo médio de vencimento; e (iv) reduzir a dívida bruta em mais de 30% em relação a 31 de dezembro de 2024. 
Nossos movimentos estratégicos de gestão de passivos refletem o compromisso da Itaúsa com a alocação eficiente de capital e criação de valor aos cionistas. 
São Paulo (SP), 25 de agosto de 2025. "
